{"schemaVersion":1,"market":{"id":"cn.at.pi","name":"CLAT Plugin Index Install Test","generatedAtUnix":2,"expiresAtUnix":100,"homepage":"https://pi.at.cn"},"publishers":[{"id":"test.publisher","name":"Test Publisher","status":"trusted","reviewUrl":"https://pi.at.cn/publishers/test.publisher","keys":[{"id":"test-1","publicKey":"RWSaMdNFicp9/MvuupaEG7iw4CCVyk+6BPMBzn0xUrdaf+P1Iiw8ihKd","status":"active","notBeforeUnix":1,"notAfterUnix":1000}]}],"packages":[{"id":"dev.clat.market-fixture","name":"Market Fixture","summary":"Signed market install fixture","description":"","homepage":"","tags":["test"],"versions":[{"version":"1.0.0","runtime":"wasm-component","publisher":"test.publisher","publisherKey":"test-1","publishedAtUnix":2,"capabilities":{"tools":true},"dependencies":{},"compatibility":{},"yanked":false,"artifacts":[{"target":"any","url":"packages/market-package.clatpkg","sha256":"703e5725c5bdc682b4e1d2b19a4a7a7ab775840b192791baf03547af786acf1f","bytes":1285}]}]}],"revocations":[],"vulnerabilities":[]}
